### ISSUE TITLE
[Bug] 开启openclash后ping不到百度谷歌等网站但是可以科学上网，而且关闭openclash后域名解析失败

### ISSUE THREAD

**Issue by HeHeHeeeeee** [vernesong/OpenClash#3060]
### Verify Steps

- [X] Tracker 我已经在 [Issue Tracker](……/) 中找过我要提出的问题
- [X] Latest 我已经使用最新 Dev 版本测试过，问题依旧存在
- [X] Core 这是 OpenClash 存在的问题，并非我所使用的 Clash 或 Meta 等内核的特定问题
- [X] Meaningful 我提交的不是无意义的 催促更新或修复 请求

### OpenClash Version

v0.45.59-beta

### Bug on Environment

Lean

### Bug on Platform

Linux-amd64(x86-64)

### To Reproduce

开启openclash再关闭

### Describe the Bug

用openwrt当旁路由，先不开openclash，可以上网；开启openclash后可以上网但ping不同百度谷歌等；关闭openclash后不能上网且ping显示无法解析域名。打开/etc/resolv.conf显示:
search lan
nameserver 127.0.0.1
nameserver ::1

只能手动在/etc/resolv.conf把域名服务器改成网关才可以上网

### OpenClash Log

无

### Expected Behavior

可能是关闭了openclash后域名解析服务器配置还是指向本机的特定端口，不会自动把域名服务器改成开启openclash之前的配置，导致无法解析，如果是这样，希望改进。还有开启openclash的时候无法ping通网站但是可以上网不知道原因是什么。

**Comment by vernesong** [comment]
你先更新插件，在看看关闭插件后dnsmasq的解析文件路径是不是填写正确，外网访问失败你发调试日志上来，或者去看看控制面板的日志

**Comment by gongzhx1998** [comment]
同样的问题    关闭后无法上网

**Comment by gongzhx1998** [comment]
同样的问题    关闭后无法上网

**Comment by jjm2473** [comment]
关闭以后无法上网的问题存在多年了吧

**Comment by gongzhx1998** [comment]
> 

怎么解决呢？
这烦死了

**Comment by stanleyblue** [comment]
同问，same issue

**Comment by HoGarfield** [comment]
请问这个问题要怎么解决？我的插件版本是[v0.45.157-beta](https://github.com/vernesong/OpenClash/releases/tag/v0.45.157-beta)， 有同样的问题

**Comment by vernesong** [comment]
dnsmasq的默认配置要还原一下，这样每次都会记住还原的路径

**Comment by HoGarfield** [comment]
> dnsmasq的默认配置要还原一下，这样每次都会记住还原的路径

破案了，跟Open Clash无关是IStore里没有把wan口桥接到Lan

**Comment by Nana2222** [comment]
> > dnsmasq的默认配置要还原一下，这样每次都会记住还原的路径
> 
> 破案了，跟Open Clash无关是IStore里没有把wan口桥接到Lan

请问具体怎么操作呢？现在是开启了oc之后，ping百度不通

**Comment by HoGarfield** [comment]
> > > dnsmasq的默认配置要还原一下，这样每次都会记住还原的路径
> > 
> > 
> > 破案了，跟Open Clash无关是IStore里没有把wan口桥接到Lan
> 
> 请问具体怎么操作呢？现在是开启了oc之后，ping百度不通

我是用软路由做旁路由，我软路由网线插的是lan口，在软路由后台的网络设置->接口那里选wan口添加桥接到lan口就可以。我的症状是只要网关用的是旁路由的，不管开不开oc都ping不通百度。

**Comment by Nana2222** [comment]
> > > > dnsmasq的默认配置要还原一下，这样每次都会记住还原的路径
> > > 
> > > 
> > > 破案了，跟Open Clash无关是IStore里没有把wan口桥接到Lan
> > 
> > 
> > 请问具体怎么操作呢？现在是开启了oc之后，ping百度不通
> 
> 我是用软路由做旁路由，我软路由网线插的是lan口，在软路由后台的网络设置->接口那里选wan口添加桥接到lan口就可以。我的症状是只要网关用的是旁路由的，不管开不开oc都ping不通百度。

我是opewrt做主路由拨号，就很奇怪为什么ping不通baidu，关闭oc就可以，而且需要重启路由。设置我基本没怎么改，就是开启了允许 IPv6 类型 DNS 解析+订阅，其他没动

**Comment by Nana2222** [comment]
> > 我是opewrt做主路由拨号，就很奇怪为什么ping不通baidu，关闭oc就可以，而且需要重启路由。设置我基本没怎么改，就是开启了允许 IPv6 类型 DNS 解析+订阅，其他没动
> 
> 主路由还涉及重启的话猜测是下发dns的问题。 检查本机dns是不是指向主路由 如果开关oc本机dns会变的话，查一下接口-lan-编辑-dhcp-高级-强制
> 
> 还有一点，ping域名不通ping ip，但其实只要能正常联网即可

等回去测试一下，感觉是dns获取的问题，但是oc配置太多，实在不好找问题在哪里。
开启oc是可以正常上网的，但是延迟会不定时变大，所以在找问题。另外家里还开启了ipv6，不知是否会跟这个有关系

**Comment by fengzhao** [comment]
> 没有把wan口桥接到Lan

主路由LAN——>旁路网关

主路由下面挂的PC都无法ping公网IP。   但是PC上网都正常。

旁路网关可以ping公网IP

旁路网关上没看到WAN口啊

**Comment by homuraLan** [comment]
同问题，ping的域名都变成内网ip了，但是可以正常科学和上网，真是奇怪，这搞得一些软件不能下载了，例如git

**Comment by Hambing** [comment]
我也是这个问题，tracert了一下，发现旁路有172.18.1.253把ICMP数据包又丢回给主路由172.18.1.254了，浏览器可以科学上网。
我是因为在主路由设置了静态路由，目标网络 198.18.0.0/16，抓发给 172.18.1.253，发现无法工作，然后 ping 和 tracert发现不对，搜索 OpenClash + ping 关键字，就来到了这个帖子。
真是个好神奇的问题，值得深入探讨~

C:\Users\Bimbing>tracert 198.18.2.193

通过最多 30 个跃点跟踪到 198.18.2.193 的路由

  1     3 ms     2 ms     2 ms  ISTOREOS [172.18.1.253]
  2     6 ms     2 ms     3 ms  172.18.1.254
  3     6 ms     7 ms     7 ms  x.x.x.x <- 主路由的Wan网关

**Comment by HeHeHeeeeee** [comment]
> 我也是这个问题，tracert了一下，发现旁路有172.18.1.253把ICMP数据包又丢回给主路由172.18.1.254了，浏览器可以科学上网。 我是因为在主路由设置了静态路由，目标网络 198.18.0.0/16，抓发给 172.18.1.253，发现无法工作，然后 ping 和 tracert发现不对，搜索 OpenClash + ping 关键字，就来到了这个帖子。 真是个好神奇的问题，值得深入探讨~
> 
> C:\Users\Bimbing>tracert 198.18.2.193
> 
> 通过最多 30 个跃点跟踪到 198.18.2.193 的路由
> 
> 1 3 ms 2 ms 2 ms ISTOREOS [172.18.1.253] 2 6 ms 2 ms 3 ms 172.18.1.254 3 6 ms 7 ms 7 ms x.x.x.x <- 主路由的Wan网关

现在这个issue过去这么久了，应该已经解决了，我现在是正常使用，没发现有什么问题。

**Comment by kugarocks** [comment]
可以尝试添加 NAT 解决这个问题：

## 环境

- OpenClash `v0.47.055`
- ImmortalWrt `24.10.5`

## ICMP 包有去无回

- 在 `macOS` 上 `ping` 不通
- 在 OpenWRT 上 `ping` 能通

```bash
ping baidu.com
```

在 OpenWRT 上通过 `tcpdump` 观察：

```bash
tcpdump -ni any icmp
```

下面是 `macOS` 的 `icmp` 包走向。

```bash
21:51:22.627273 eth1  In  IP 10.24.2.1 > 110.242.74.102: ICMP echo request, id 43537, seq 2, length 64
21:51:22.627273 br-lan In  IP 10.24.2.1 > 110.242.74.102: ICMP echo request, id 43537, seq 2, length 64
21:51:22.627331 br-lan Out IP 10.24.2.1 > 110.242.74.102: ICMP echo request, id 43537, seq 2, length 64
21:51:22.627338 eth1  Out IP 10.24.2.1 > 110.242.74.102: ICMP echo request, id 43537, seq 2, length 64
```

AI 的回答如下：

```bash
核心发现：有去无回，包丢在了“回程”路上
对比两组数据，你会发现一个非常关键的区别：

OpenWrt 自己 Ping 时： 既有 Out（发出），也有 In（收到 echo reply 回应）。

Mac 经由 OpenWrt Ping 时：

21:51:22.627273: OpenWrt 收到来自 Mac (10.24.2.1) 的请求。

21:51:22.627338: OpenWrt 成功把这个请求转发给了外网。

然后就没有然后了。 没有任何 In（回应包）回到 OpenWrt。

为什么会出现这种情况？
这是旁路由最经典的 “三角路由” (Asymmetric Routing) 问题：

去程： Mac (10.24.2.1) -> OpenWrt (10.24.2.253) -> 主路由 -> 互联网（这是通的）。

回程： 互联网响应 -> 主路由 -> 主路由直接把包发给了 Mac（因为 Mac 和主路由在同一网段）。

死结： Mac 收到这个包时，发现来源 IP 是目标网站，但它之前是把请求发给旁路由的。Mac 的防火墙/协议栈会认为这个“未经旁路由转手的回程包”是不安全的或者状态不匹配的，直接将其丢弃。
```

## 解决方法

- 如果你是 `iptables` 则通过添加 `MASQUERADE` 解决
- 我的环境是 `ImmortalWrt`，需要修改防火墙：

```bash
vi /etc/config/firewall
```

在文件尾部添加：

```bash
config nat
    option name 'Bypass-NAT'
    option family 'ipv4'
    option src 'lan'
    option dest 'lan'
    option target 'MASQUERADE'
    option src_ip '10.24.2.0/24'
```

重启生效，需要短暂等待：

```bash
fw4 reload
```

@gongzhx1998 @stanleyblue @HoGarfield @Nana2222 @fengzhao @Hambing
